{
  "id": "workflow.ai-ui-generation",
  "type": "workflow",
  "version": "1.0.0",
  "title": "AI UI generation",
  "summary": "A builder workflow that turns intent into interface proposals while staying inside design-system or portable implementation authority, frontend guardrails/examples, accessibility, and budget constraints.",
  "status": "active",
  "description": "A workflow that generates UI structure, visual direction, reusable component recipes, copy, and implementation direction for product teams while keeping the output traceable, design-system-first when a system exists, JudgmentKit-authoritative when one does not, accessibility-aware, theme-complete, and system-safe. Frontend visual direction is subsumed into workflow guardrails and calibration examples rather than a separate playbook or profile.",
  "primary_users": ["design systems", "product design", "frontend engineering"],
  "decisions": [
    "which components, recipes, and tokens to use",
    "whether the referenced design system is authoritative for the requested surface",
    "when the JudgmentKit no-design-system constraint pack must become the source of truth",
    "which visual surface mode governs a visually led task",
    "when a visually led task needs a visual thesis, content plan, and interaction thesis before implementation",
    "whether the design system has an accessibility baseline or owner-approved review status",
    "how much layout variation is acceptable",
    "when imagery and motion have enough purpose to ship or should be downgraded",
    "whether the final response includes the required visual output contract",
    "when control placement obscures which surface a local control governs",
    "when embedded code or artifact surfaces drift away from the surrounding theme model",
    "when UI copy elements are too repetitive or semantically overlapping",
    "when a spec sounds disciplined but still leaves primitives, recipes, tokens, or states implicit",
    "when component names are present but actual component composition is still unproven",
    "when a first pass is too ornamental for zero-shot generation",
    "when light and dark mode support should be assumed",
    "when to simplify due to runtime budget",
    "when a requested pattern requires design review",
    "what evidence to carry into implementation handoff",
    "whether screenshots are derived from the same component evidence the judge reads"
  ],
  "required_inputs": [
    "feature intent",
    "target surface",
    "design system inventory or explicit no-design-system confirmation",
    "visual-direction intent or explicit purely functional scope",
    "accessibility baseline or design-system review status",
    "time and budget target"
  ],
  "common_guardrails": [
    "guardrail.design-system-integrity",
    "guardrail.spec-completeness",
    "guardrail.surface-mode-structure",
    "guardrail.visual-planning-contract",
    "guardrail.motion-media-purpose",
    "guardrail.frontend-output-contract",
    "guardrail.ui-copy-clarity",
    "guardrail.control-proximity",
    "guardrail.surface-theme-parity",
    "guardrail.runtime-cost",
    "guardrail.provenance-escalation"
  ],
  "risk_profile": {
    "risk_level": "medium",
    "main_risks": [
      "component drift",
      "surface mode drift",
      "visual planning gaps",
      "decorative motion or media",
      "missing visual output contract",
      "token vagueness",
      "primitive sprawl",
      "ambiguous state coverage",
      "name-only component mapping",
      "non-reusable screen markup",
      "missing recipe accessibility API",
      "hand-authored preview drift",
      "theme bindings not attached to recipes",
      "shallow implementation handoff",
      "ambiguous label redundancy",
      "detached local controls",
      "mismatched code or artifact themes",
      "design-system override without review",
      "unknown design-system accessibility status",
      "ornamental zero-shot output",
      "missing theme support",
      "accessibility regressions",
      "excessive generation cost",
      "ambiguous implementation handoff"
    ]
  },
  "links": {
    "docs_url": "https://judgmentkit.ai/docs/workflows/ai-ui-generation",
    "markdown_url": "https://judgmentkit.ai/docs/workflows/ai-ui-generation.md",
    "schema_url": "https://judgmentkit.ai/schemas/workflow.schema.json",
    "constraint_pack_ids": [
      "constraint-pack.ai-ui-no-design-system"
    ],
    "guideline_profile_ids": [
      "guideline-profile.ai-ui-generation-authority",
      "guideline-profile.ai-ui-review-checks"
    ],
    "example_ids": [
      "example.ui-generation.component-drift",
      "example.ui-generation.embellishment-drift",
      "example.ui-generation.mode-structure-drift",
      "example.ui-generation.visual-planning-gap",
      "example.ui-generation.motion-media-drift",
      "example.ui-generation.output-contract-gap",
      "example.ui-generation.onboarding-clarity-drift",
      "example.ui-generation.repetitive-copy-drift",
      "example.ui-generation.control-proximity-drift",
      "example.ui-generation.surface-theme-parity-drift",
      "example.ui-generation.token-vagueness-drift",
      "example.ui-generation.primitive-sprawl-drift",
      "example.ui-generation.shallow-handoff-drift",
      "example.ui-generation.state-coverage-drift",
      "example.ui-generation.component-mapping-name-only-drift",
      "example.ui-generation.non-reusable-recipe-drift",
      "example.ui-generation.missing-accessibility-api-drift",
      "example.ui-generation.hand-authored-preview-drift",
      "example.ui-generation.theme-binding-recipe-drift"
    ]
  },
  "last_reviewed": "2026-04-23"
}
